ttile/autotvm/tests/autotvm_conv2d.log
{"input": ["opencl -keys=kmppa,opencl,gpu -device=kmppa -max_num_threads=16", "conv2d_ttile_", [1, 56, 56, 128, 128, 3, 3, 1, 1, 1, 1, 1, 1], {}], "config": {"index": 2082, "code_hash": null, "entity": [["tile_in_channels", "ot", 4], ["tile_out_channels", "ot", 16], ["tile_xx", "ot", 1], ["tile_yy", "ot", 8]]}, "result": [[0.071283740175, 0.071281264275], 0, 8.487163305282593, 1615555357.1537154], "version": 0.2, "tvm_version": "0.8.dev0"}
{"input": ["opencl -keys=kmppa,opencl,gpu -device=kmppa -max_num_threads=16", "conv2d_ttile_", [1, 56, 56, 128, 128, 3, 3, 1, 1, 1, 1, 1, 1], {}], "config": {"index": 345, "code_hash": null, "entity": [["tile_in_channels", "ot", 2], ["tile_out_channels", "ot", 8], ["tile_xx", "ot", 14], ["tile_yy", "ot", 1]]}, "result": [[0.1211578461, 0.12140171527500002], 0, 11.933428287506104, 1615556721.3733685], "version": 0.2, "tvm_version": "0.8.dev0"}
{"input": ["opencl -keys=kmppa,opencl,gpu -device=kmppa -max_num_threads=16", "conv2d_ttile_", [1, 56, 56, 128, 128, 3, 3, 1, 1, 1, 1, 1, 1], {}], "config": {"index": 2067, "code_hash": null, "entity": [["tile_in_channels", "ot", 8], ["tile_out_channels", "ot", 4], ["tile_xx", "ot", 1], ["tile_yy", "ot", 8]]}, "result": [[0.12360519654999999, 0.12363475665000001], 0, 12.179551362991333, 1615556754.6351902], "version": 0.2, "tvm_version": "0.8.dev0"}
{"input": ["opencl -keys=kmppa,opencl,gpu -device=kmppa -max_num_threads=16", "conv2d_ttile_", [1, 56, 56, 128, 128, 3, 3, 1, 1, 1, 1, 1, 1], {}], "config": {"index": 2582, "code_hash": null, "entity": [["tile_in_channels", "ot", 64], ["tile_out_channels", "ot", 4], ["tile_xx", "ot", 1], ["tile_yy", "ot", 14]]}, "result": [[0.0841096362, 0.084047741275], 0, 8.8483304977417, 1615556820.0420513], "version": 0.2, "tvm_version": "0.8.dev0"}
{"input": ["opencl -keys=kmppa,opencl,gpu -device=kmppa -max_num_threads=16", "conv2d_ttile_", [1, 56, 56, 128, 128, 3, 3, 1, 1, 1, 1, 1, 1], {}], "config": {"index": 787, "code_hash": null, "entity": [["tile_in_channels", "ot", 8], ["tile_out_channels", "ot", 4], ["tile_xx", "ot", 8], ["tile_yy", "ot", 2]]}, "result": [[0.0981531256, 0.098106216775], 0, 10.156832218170166, 1615556858.1205463], "version": 0.2, "tvm_version": "0.8.dev0"}
{"input": ["opencl -keys=kmppa,opencl,gpu -device=kmppa -max_num_threads=16", "conv2d_ttile_", [1, 56, 56, 128, 128, 3, 3, 1, 1, 1, 1, 1, 1], {}], "config": {"index": 2597, "code_hash": null, "entity": [["tile_in_channels", "ot", 32], ["tile_out_channels", "ot", 16], ["tile_xx", "ot", 1], ["tile_yy", "ot", 14]]}, "result": [[0.048713973925, 0.04873036385], 0, 6.590193271636963, 1615556895.2327635], "version": 0.2, "tvm_version": "0.8.dev0"}
{"input": ["opencl -keys=kmppa,opencl,gpu -device=kmppa -max_num_threads=16", "conv2d_ttile_", [1, 56, 56, 128, 128, 3, 3, 1, 1, 1, 1, 1, 1], {}], "config": {"index": 2457, "code_hash": null, "entity": [["tile_in_channels", "ot", 2], ["tile_out_channels", "ot", 8], ["tile_xx", "ot", 28], ["tile_yy", "ot", 8]]}, "result": [[0.0040], 1, 0.021988391876220703, 1615556901.4946768], "version": 0.2, "tvm_version": "0.8.dev0"}
{"input": ["opencl -keys=kmppa,opencl,gpu -device=kmppa -max_num_threads=16", "conv2d_ttile_", [1, 56, 56, 128, 128, 3, 3, 1, 1, 1, 1, 1, 1], {}], "config": {"index": 1161, "code_hash": null, "entity": [["tile_in_channels", "ot", 2], ["tile_out_channels", "ot", 2], ["tile_xx", "ot", 4], ["tile_yy", "ot", 4]]}, "result": [[0.11717207185, 0.11717226384999999], 0, 11.570351362228394, 1615557252.92154], "version": 0.2, "tvm_version": "0.8.dev0"}
{"input": ["opencl -keys=kmppa,opencl,gpu -device=kmppa -max_num_threads=16", "conv2d_ttile_", [1, 56, 56, 128, 128, 3, 3, 1, 1, 1, 1, 1, 1], {}], "config": {"index": 1164, "code_hash": null, "entity": [["tile_in_channels", "ot", 16], ["tile_out_channels", "ot", 2], ["tile_xx", "ot", 4], ["tile_yy", "ot", 4]]}, "result": [[0.129493501925, 0.1295354659], 0, 12.562242031097412, 1615557588.833275], "version": 0.2, "tvm_version": "0.8.dev0"}
{"input": ["opencl -keys=kmppa,opencl,gpu -device=kmppa -max_num_threads=16", "conv2d_ttile_", [1, 56, 56, 128, 128, 3, 3, 1, 1, 1, 1, 1, 1], {}], "config": {"index": 1609, "code_hash": null, "entity": [["tile_in_channels", "ot", 2], ["tile_out_channels", "ot", 2], ["tile_xx", "ot", 2], ["tile_yy", "ot", 7]]}, "result": [[0.130246449325, 0.130246026775], 0, 12.64668083190918, 1615557648.23209], "version": 0.2, "tvm_version": "0.8.dev0"}
{"input": ["opencl -keys=kmppa,opencl,gpu -device=kmppa -max_num_threads=16", "conv2d_ttile_", [1, 56, 56, 128, 128, 3, 3, 1, 1, 1, 1, 1, 1], {}], "config": {"index": 1111, "code_hash": null, "entity": [["tile_in_channels", "ot", 128], ["tile_out_channels", "ot", 4], ["tile_xx", "ot", 2], ["tile_yy", "ot", 4]]}, "result": [[0.142100337425, 0.1420717846], 0, 13.57970643043518, 1615557666.561236], "version": 0.2, "tvm_version": "0.8.dev0"}
{"input": ["opencl -keys=kmppa,opencl,gpu -device=kmppa -max_num_threads=16", "conv2d_ttile_", [1, 56, 56, 128, 128, 3, 3, 1, 1, 1, 1, 1, 1], {}], "config": {"index": 1169, "code_hash": null, "entity": [["tile_in_channels", "ot", 2], ["tile_out_channels", "ot", 4], ["tile_xx", "ot", 4], ["tile_yy", "ot", 4]]}, "result": [[0.07140174325000001, 0.07139112565], 0, 7.866359710693359, 1615557704.8481293], "version": 0.2, "tvm_version": "0.8.dev0"}
{"input": ["opencl -keys=kmppa,opencl,gpu -device=kmppa -max_num_threads=16", "conv2d_ttile_", [1, 56, 56, 128, 128, 3, 3, 1, 1, 1, 1, 1, 1], {}], "config": {"index": 1177, "code_hash": null, "entity": [["tile_in_channels", "ot", 2], ["tile_out_channels", "ot", 8], ["tile_xx", "ot", 4], ["tile_yy", "ot", 4]]}, "result": [[0.06013295372500001, 0.06017283995], 0, 6.94085168838501, 1615557728.1886067], "version": 0.2, "tvm_version": "0.8.dev0"}
{"input": ["opencl -keys=kmppa,opencl,gpu -device=kmppa -max_num_threads=16", "conv2d_ttile_", [1, 56, 56, 128, 128, 3, 3, 1, 1, 1, 1, 1, 1], {}], "config": {"index": 1612, "code_hash": null, "entity": [["tile_in_channels", "ot", 16], ["tile_out_channels", "ot", 2], ["tile_xx", "ot", 2], ["tile_yy", "ot", 7]]}, "result": [[0.1451690494, 0.1451743564], 0, 13.796769618988037, 1615557763.1722622], "version": 0.2, "tvm_version": "0.8.dev0"}
{"input": ["opencl -keys=kmppa,opencl,gpu -device=kmppa -max_num_threads=16", "conv2d_ttile_", [1, 56, 56, 128, 128, 3, 3, 1, 1, 1, 1, 1, 1], {}], "config": {"index": 1153, "code_hash": null, "entity": [["tile_in_channels", "ot", 2], ["tile_out_channels", "ot", 1], ["tile_xx", "ot", 4], ["tile_yy", "ot", 4]]}, "result": [[0.145412119, 0.14539876627499998], 0, 13.80106258392334, 1615557779.4325686], "version": 0.2, "tvm_version": "0.8.dev0"}
{"input": ["opencl -keys=kmppa,opencl,gpu -device=kmppa -max_num_threads=16", "conv2d_ttile_", [1, 56, 56, 128, 128, 3, 3, 1, 1, 1, 1, 1, 1], {}], "config": {"index": 1163, "code_hash": null, "entity": [["tile_in_channels", "ot", 8], ["tile_out_channels", "ot", 2], ["tile_xx", "ot", 4], ["tile_yy", "ot", 4]]}, "result": [[0.114841224, 0.11485462857499999], 0, 11.44942021369934, 1615557825.9904277], "version": 0.2, "tvm_version": "0.8.dev0"}
{"input": ["opencl -keys=kmppa,opencl,gpu -device=kmppa -max_num_threads=16", "conv2d_ttile_", [1, 56, 56, 128, 128, 3, 3, 1, 1, 1, 1, 1, 1], {}], "config": {"index": 1105, "code_hash": null, "entity": [["tile_in_channels", "ot", 2], ["tile_out_channels", "ot", 4], ["tile_xx", "ot", 2], ["tile_yy", "ot", 4]]}, "result": [[0.1262495242, 0.1262531996], 0, 12.35409164428711, 1615557840.8093207], "version": 0.2, "tvm_version": "0.8.dev0"}
{"input": ["opencl -keys=kmppa,opencl,gpu -device=kmppa -max_num_threads=16", "conv2d_ttile_", [1, 56, 56, 128, 128, 3, 3, 1, 1, 1, 1, 1, 1], {}], "config": {"index": 2121, "code_hash": null, "entity": [["tile_in_channels", "ot", 2], ["tile_out_channels", "ot", 2], ["tile_xx", "ot", 2], ["tile_yy", "ot", 8]]}, "result": [[0.1166242452, 0.11656092055], 0, 11.581096172332764, 1615557857.2349389], "version": 0.2, "tvm_version": "0.8.dev0"}
{"input": ["opencl -keys=kmppa,opencl,gpu -device=kmppa -max_num_threads=16", "conv2d_ttile_", [1, 56, 56, 128, 128, 3, 3, 1, 1, 1, 1, 1, 1], {}], "config": {"index": 1059, "code_hash": null, "entity": [["tile_in_channels", "ot", 8], ["tile_out_channels", "ot", 16], ["tile_xx", "ot", 1], ["tile_yy", "ot", 4]]}, "result": [[0.13325353965, 0.13325236985], 0, 13.45557689666748, 1615557898.7118435], "version": 0.2, "tvm_version": "0.8.dev0"}
{"input": ["opencl -keys=kmppa,opencl,gpu -device=kmppa -max_num_threads=16", "conv2d_ttile_", [1, 56, 56, 128, 128, 3, 3, 1, 1, 1, 1, 1, 1], {}], "config": {"index": 2123, "code_hash": null, "entity": [["tile_in_channels", "ot", 8], ["tile_out_channels", "ot", 2], ["tile_xx", "ot", 2], ["tile_yy", "ot", 8]]}, "result": [[0.11464332964999999, 0.11457381900000001], 0, 11.444271087646484, 1615557912.637786], "version": 0.2, "tvm_version": "0.8.dev0"}
{"input": ["opencl -keys=kmppa,opencl,gpu -device=kmppa -max_num_threads=16", "conv2d_ttile_", [1, 56, 56, 128, 128, 3, 3, 1, 1, 1, 1, 1, 1], {}], "config": {"index": 1180, "code_hash": null, "entity": [["tile_in_channels", "ot", 16], ["tile_out_channels", "ot", 8], ["tile_xx", "ot", 4], ["tile_yy", "ot", 4]]}, "result": [[0.0635445669, 0.063510414175], 0, 7.2813873291015625, 1615557924.5725734], "version": 0.2, "tvm_version": "0.8.dev0"}
{"input": ["opencl -keys=kmppa,opencl,gpu -device=kmppa -max_num_threads=16", "conv2d_ttile_", [1, 56, 56, 128, 128, 3, 3, 1, 1, 1, 1, 1, 1], {}], "config": {"index": 1167, "code_hash": null, "entity": [["tile_in_channels", "ot", 128], ["tile_out_channels", "ot", 2], ["tile_xx", "ot", 4], ["tile_yy", "ot", 4]]}, "result": [[0.12863038442500002, 0.12861377300000001], 0, 12.446098566055298, 1615557941.6239479], "version": 0.2, "tvm_version": "0.8.dev0"}
{"input": ["opencl -keys=kmppa,opencl,gpu -device=kmppa -max_num_threads=16", "conv2d_ttile_", [1, 56, 56, 128, 128, 3, 3, 1, 1, 1, 1, 1, 1], {}], "config": {"index": 1119, "code_hash": null, "entity": [["tile_in_channels", "ot", 128], ["tile_out_channels", "ot", 8], ["tile_xx", "ot", 2], ["tile_yy", "ot", 4]]}, "result": [[0.107556287775, 0.10764659487499999], 0, 10.845029354095459, 1615557955.0883076], "version": 0.2, "tvm_version": "0.8.dev0"}
{"input": ["opencl -keys=kmppa,opencl,gpu -device=kmppa -max_num_threads=16", "conv2d_ttile_", [1, 56, 56, 128, 128, 3, 3, 1, 1, 1, 1, 1, 1], {}], "config": {"index": 1110, "code_hash": null, "entity": [["tile_in_channels", "ot", 64], ["tile_out_channels", "ot", 4], ["tile_xx", "ot", 2], ["tile_yy", "ot", 4]]}, "result": [[0.142092670975, 0.1421057837], 0, 13.581984281539917, 1615557975.79095], "version": 0.2, "tvm_version": "0.8.dev0"}
{"input": ["opencl -keys=kmppa,opencl,gpu -device=kmppa -max_num_threads=16", "conv2d_ttile_", [1, 56, 56, 128, 128, 3, 3, 1, 1, 1, 1, 1, 1], {}], "config": {"index": 1179, "code_hash": null, "entity": [["tile_in_channels", "ot", 8], ["tile_out_channels", "ot", 8], ["tile_xx", "ot", 4], ["tile_yy", "ot", 4]]}, "result": [[0.0631645176, 0.0632337962], 0, 7.270815849304199, 1615557988.0856533], "version": 0.2, "tvm_version": "0.8.dev0"}
{"input": ["opencl -keys=kmppa,opencl,gpu -device=kmppa -max_num_threads=16", "conv2d_ttile_", [1, 56, 56, 128, 128, 3, 3, 1, 1, 1, 1, 1, 1], {}], "config": {"index": 1175, "code_hash": null, "entity": [["tile_in_channels", "ot", 128], ["tile_out_channels", "ot", 4], ["tile_xx", "ot", 4], ["tile_yy", "ot", 4]]}, "result": [[0.07818434387499999, 0.0782342763], 0, 8.53635549545288, 1615557999.0981767], "version": 0.2, "tvm_version": "0.8.dev0"}
{"input": ["opencl -keys=kmppa,opencl,gpu -device=kmppa -max_num_threads=16", "conv2d_ttile_", [1, 56, 56, 128, 128, 3, 3, 1, 1, 1, 1, 1, 1], {}], "config": {"index": 1172, "code_hash": null, "entity": [["tile_in_channels", "ot", 16], ["tile_out_channels", "ot", 4], ["tile_xx", "ot", 4], ["tile_yy", "ot", 4]]}, "result": [[0.0780176349, 0.078011493675], 0, 8.430010318756104, 1615558033.3395467], "version": 0.2, "tvm_version": "0.8.dev0"}
{"input": ["opencl -keys=kmppa,opencl,gpu -device=kmppa -max_num_threads=16", "conv2d_ttile_", [1, 56, 56, 128, 128, 3, 3, 1, 1, 1, 1, 1, 1], {}], "config": {"index": 1623, "code_hash": null, "entity": [["tile_in_channels", "ot", 128], ["tile_out_channels", "ot", 4], ["tile_xx", "ot", 2], ["tile_yy", "ot", 7]]}, "result": [[0.08405766805, 0.08402031997500001], 0, 8.823530912399292, 1615558051.7120137], "version": 0.2, "tvm_version": "0.8.dev0"}
{"input": ["opencl -keys=kmppa,opencl,gpu -device=kmppa -max_num_threads=16", "conv2d_ttile_", [1, 56, 56, 128, 128, 3, 3, 1, 1, 1, 1, 1, 1], {}], "config": {"index": 1104, "code_hash": null, "entity": [["tile_in_channels", "ot", 1], ["tile_out_channels", "ot", 4], ["tile_xx", "ot", 2], ["tile_yy", "ot", 4]]}, "result": [[0.132229592925, 0.132194280075], 0, 12.765072345733643, 1615558087.9514875], "version": 0.2, "tvm_version": "0.8.dev0"}
{"input": ["opencl -keys=kmppa,opencl,gpu -device=kmppa -max_num_threads=16", "conv2d_ttile_", [1, 56, 56, 128, 128, 3, 3, 1, 1, 1, 1, 1, 1], {}], "config": {"index": 1621, "code_hash": null, "entity": [["tile_in_channels", "ot", 32], ["tile_out_channels", "ot", 4], ["tile_xx", "ot", 2], ["tile_yy", "ot", 7]]}, "result": [[0.0839973129, 0.08400053560000001], 0, 8.901833295822144, 1615558101.6360712], "version": 0.2, "tvm_version": "0.8.dev0"}
{"input": ["opencl -keys=kmppa,opencl,gpu -device=kmppa -max_num_threads=16", "conv2d_ttile_", [1, 56, 56, 128, 128, 3, 3, 1, 1, 1, 1, 1, 1], {}], "config": {"index": 1168, "code_hash": null, "entity": [["tile_in_channels", "ot", 1], ["tile_out_channels", "ot", 4], ["tile_xx", "ot", 4], ["tile_yy", "ot", 4]]}, "result": [[0.0739455567, 0.073945196675], 0, 8.034324407577515, 1615558112.1643267], "version": 0.2, "tvm_version": "0.8.dev0"}
{"input": ["opencl -keys=kmppa,opencl,gpu -device=kmppa -max_num_threads=16", "conv2d_ttile_", [1, 56, 56, 128, 128, 3, 3, 1, 1, 1, 1, 1, 1], {}], "config": {"index": 1614, "code_hash": null, "entity": [["tile_in_channels", "ot", 64], ["tile_out_channels", "ot", 2], ["tile_xx", "ot", 2], ["tile_yy", "ot", 7]]}, "result": [[0.14253035235, 0.14252297419999999], 0, 13.571327447891235, 1615558151.551423], "version": 0.2, "tvm_version": "0.8.dev0"}
{"input": ["opencl -keys=kmppa,opencl,gpu -device=kmppa -max_num_threads=16", "conv2d_ttile_", [1, 56, 56, 128, 128, 3, 3, 1, 1, 1, 1, 1, 1], {}], "config": {"index": 1109, "code_hash": null, "entity": [["tile_in_channels", "ot", 32], ["tile_out_channels", "ot", 4], ["tile_xx", "ot", 2], ["tile_yy", "ot", 4]]}, "result": [[0.14204747795, 0.142009837675], 0, 13.544104099273682, 1615558167.693516], "version": 0.2, "tvm_version": "0.8.dev0"}
{"input": ["opencl -keys=kmppa,opencl,gpu -device=kmppa -max_num_threads=16", "conv2d_ttile_", [1, 56, 56, 128, 128, 3, 3, 1, 1, 1, 1, 1, 1], {}], "config": {"index": 1183, "code_hash": null, "entity": [["tile_in_channels", "ot", 128], ["tile_out_channels", "ot", 8], ["tile_xx", "ot", 4], ["tile_yy", "ot", 4]]}, "result": [[0.06521204682500001, 0.065142072775], 0, 7.398882150650024, 1615558177.5252883], "version": 0.2, "tvm_version": "0.8.dev0"}
{"input": ["opencl -keys=kmppa,opencl,gpu -device=kmppa -max_num_threads=16", "conv2d_ttile_", [1, 56, 56, 128, 128, 3, 3, 1, 1, 1, 1, 1, 1], {}], "config": {"index": 1613, "code_hash": null, "entity": [["tile_in_channels", "ot", 32], ["tile_out_channels", "ot", 2], ["tile_xx", "ot", 2], ["tile_yy", "ot", 7]]}, "result": [[0.145087310875, 0.1450116072], 0, 13.790512323379517, 1615558193.8603818], "version": 0.2, "tvm_version": "0.8.dev0"}
{"input": ["opencl -keys=kmppa,opencl,gpu -device=kmppa -max_num_threads=16", "conv2d_ttile_", [1, 56, 56, 128, 128, 3, 3, 1, 1, 1, 1, 1, 1], {}], "config": {"index": 1107, "code_hash": null, "entity": [["tile_in_channels", "ot", 8], ["tile_out_channels", "ot", 4], ["tile_xx", "ot", 2], ["tile_yy", "ot", 4]]}, "result": [[0.1239241697, 0.123920788625], 0, 12.268664360046387, 1615558243.2384057], "version": 0.2, "tvm_version": "0.8.dev0"}
{"input": ["opencl -keys=kmppa,opencl,gpu -device=kmppa -max_num_threads=16", "conv2d_ttile_", [1, 56, 56, 128, 128, 3, 3, 1, 1, 1, 1, 1, 1], {}], "config": {"index": 1106, "code_hash": null, "entity": [["tile_in_channels", "ot", 4], ["tile_out_channels", "ot", 4], ["tile_xx", "ot", 2], ["tile_yy", "ot", 4]]}, "result": [[0.1295432641, 0.12953510067500001], 0, 12.594107627868652, 1615558302.5329745], "version": 0.2, "tvm_version": "0.8.dev0"}
{"input": ["opencl -keys=kmppa,opencl,gpu -device=kmppa -max_num_threads=16", "conv2d_ttile_", [1, 56, 56, 128, 128, 3, 3, 1, 1, 1, 1, 1, 1], {}], "config": {"index": 2134, "code_hash": null, "entity": [["tile_in_channels", "ot", 64], ["tile_out_channels", "ot", 4], ["tile_xx", "ot", 2], ["tile_yy", "ot", 8]]}, "result": [[0.07564910514999999, 0.07562245355], 0, 8.173569917678833, 1615558331.6393685], "version": 0.2, "tvm_version": "0.8.dev0"}
{"input": ["opencl -keys=kmppa,opencl,gpu -device=kmppa -max_num_threads=16", "conv2d_ttile_", [1, 56, 56, 128, 128, 3, 3, 1, 1, 1, 1, 1, 1], {}], "config": {"index": 1181, "code_hash": null, "entity": [["tile_in_channels", "ot", 32], ["tile_out_channels", "ot", 8], ["tile_xx", "ot", 4], ["tile_yy", "ot", 4]]}, "result": [[0.063706688875, 0.063706980325], 0, 7.274771451950073, 1615558376.4160216], "version": 0.2, "tvm_version": "0.8.dev0"}
{"input": ["opencl -keys=kmppa,opencl,gpu -device=kmppa -max_num_threads=16", "conv2d_ttile_", [1, 56, 56, 128, 128, 3, 3, 1, 1, 1, 1, 1, 1], {}], "config": {"index": 1121, "code_hash": null, "entity": [["tile_in_channels", "ot", 2], ["tile_out_channels", "ot", 16], ["tile_xx", "ot", 2], ["tile_yy", "ot", 4]]}, "result": [[0.07839637575, 0.0783627261], 0, 9.096906185150146, 1615558388.0315526], "version": 0.2, "tvm_version": "0.8.dev0"}
{"input": ["opencl -keys=kmppa,opencl,gpu -device=kmppa -max_num_threads=16", "conv2d_ttile_", [1, 56, 56, 128, 128, 3, 3, 1, 1, 1, 1, 1, 1], {}], "config": {"index": 1165, "code_hash": null, "entity": [["tile_in_channels", "ot", 32], ["tile_out_channels", "ot", 2], ["tile_xx", "ot", 4], ["tile_yy", "ot", 4]]}, "result": [[0.129551647675, 0.129578083675], 0, 12.533109188079834, 1615558402.942296], "version": 0.2, "tvm_version": "0.8.dev0"}
{"input": ["opencl -keys=kmppa,opencl,gpu -device=kmppa -max_num_threads=16", "conv2d_ttile_", [1, 56, 56, 128, 128, 3, 3, 1, 1, 1, 1, 1, 1], {}], "config": {"index": 1617, "code_hash": null, "entity": [["tile_in_channels", "ot", 2], ["tile_out_channels", "ot", 4], ["tile_xx", "ot", 2], ["tile_yy", "ot", 7]]}, "result": [[0.075908507775, 0.07588460095], 0, 8.30469274520874, 1615558420.792465], "version": 0.2, "tvm_version": "0.8.dev0"}
{"input": ["opencl -keys=kmppa,opencl,gpu -device=kmppa -max_num_threads=16", "conv2d_ttile_", [1, 56, 56, 128, 128, 3, 3, 1, 1, 1, 1, 1, 1], {}], "config": {"index": 1116, "code_hash": null, "entity": [["tile_in_channels", "ot", 16], ["tile_out_channels", "ot", 8], ["tile_xx", "ot", 2], ["tile_yy", "ot", 4]]}, "result": [[0.10572521165, 0.10574176537499999], 0, 10.7207350730896, 1615558436.3092594], "version": 0.2, "tvm_version": "0.8.dev0"}
{"input": ["opencl -keys=kmppa,opencl,gpu -device=kmppa -max_num_threads=16", "conv2d_ttile_", [1, 56, 56, 128, 128, 3, 3, 1, 1, 1, 1, 1, 1], {}], "config": {"index": 1173, "code_hash": null, "entity": [["tile_in_channels", "ot", 32], ["tile_out_channels", "ot", 4], ["tile_xx", "ot", 4], ["tile_yy", "ot", 4]]}, "result": [[0.07800133415, 0.078010355675], 0, 8.3735032081604, 1615558484.1902037], "version": 0.2, "tvm_version": "0.8.dev0"}
{"input": ["opencl -keys=kmppa,opencl,gpu -device=kmppa -max_num_threads=16", "conv2d_ttile_", [1, 56, 56, 128, 128, 3, 3, 1, 1, 1, 1, 1, 1], {}], "config": {"index": 1170, "code_hash": null, "entity": [["tile_in_channels", "ot", 4], ["tile_out_channels", "ot", 4], ["tile_xx", "ot", 4], ["tile_yy", "ot", 4]]}, "result": [[0.072879686975, 0.072911578], 0, 7.993162155151367, 1615558494.6705494], "version": 0.2, "tvm_version": "0.8.dev0"}
{"input": ["opencl -keys=kmppa,opencl,gpu -device=kmppa -max_num_threads=16", "conv2d_ttile_", [1, 56, 56, 128, 128, 3, 3, 1, 1, 1, 1, 1, 1], {}], "config": {"index": 1188, "code_hash": null, "entity": [["tile_in_channels", "ot", 16], ["tile_out_channels", "ot", 16], ["tile_xx", "ot", 4], ["tile_yy", "ot", 4]]}, "result": [[0.054389490425, 0.054389612525], 0, 7.121996641159058, 1615558511.2565014], "version": 0.2, "tvm_version": "0.8.dev0"}
{"input": ["opencl -keys=kmppa,opencl,gpu -device=kmppa -max_num_threads=16", "conv2d_ttile_", [1, 56, 56, 128, 128, 3, 3, 1, 1, 1, 1, 1, 1], {}], "config": {"index": 2128, "code_hash": null, "entity": [["tile_in_channels", "ot", 1], ["tile_out_channels", "ot", 4], ["tile_xx", "ot", 2], ["tile_yy", "ot", 8]]}, "result": [[0.073965127275, 0.07396609444999999], 0, 8.024562120437622, 1615558568.2628295], "version": 0.2, "tvm_version": "0.8.dev0"}
{"input": ["opencl -keys=kmppa,opencl,gpu -device=kmppa -max_num_threads=16", "conv2d_ttile_", [1, 56, 56, 128, 128, 3, 3, 1, 1, 1, 1, 1, 1], {}], "config": {"index": 1174, "code_hash": null, "entity": [["tile_in_channels", "ot", 64], ["tile_out_channels", "ot", 4], ["tile_xx", "ot", 4], ["tile_yy", "ot", 4]]}, "result": [[0.0781169971, 0.078118110925], 0, 8.365325927734375, 1615558597.782356], "version": 0.2, "tvm_version": "0.8.dev0"}
{"input": ["opencl -keys=kmppa,opencl,gpu -device=kmppa -max_num_threads=16", "conv2d_ttile_", [1, 56, 56, 128, 128, 3, 3, 1, 1, 1, 1, 1, 1], {}], "config": {"index": 1171, "code_hash": null, "entity": [["tile_in_channels", "ot", 8], ["tile_out_channels", "ot", 4], ["tile_xx", "ot", 4], ["tile_yy", "ot", 4]]}, "result": [[0.06988338857500001, 0.06988494417499999], 0, 7.8813135623931885, 1615558610.3085556], "version": 0.2, "tvm_version": "0.8.dev0"}
{"input": ["opencl -keys=kmppa,opencl,gpu -device=kmppa -max_num_threads=16", "conv2d_ttile_", [1, 56, 56, 128, 128, 3, 3, 1, 1, 1, 1, 1, 1], {}], "config": {"index": 1166, "code_hash": null, "entity": [["tile_in_channels", "ot", 64], ["tile_out_channels", "ot", 2], ["tile_xx", "ot", 4], ["tile_yy", "ot", 4]]}, "result": [[0.12723853325, 0.127231836875], 0, 12.30733323097229, 1615558625.1160307], "version": 0.2, "tvm_version": "0.8.dev0"}
{"input": ["opencl -keys=kmppa,opencl,gpu -device=kmppa -max_num_threads=16", "conv2d_ttile_", [1, 56, 56, 128, 128, 3, 3, 1, 1, 1, 1, 1, 1], {}], "config": {"index": 1108, "code_hash": null, "entity": [["tile_in_channels", "ot", 16], ["tile_out_channels", "ot", 4], ["tile_xx", "ot", 2], ["tile_yy", "ot", 4]]}, "result": [[0.1420546328, 0.142040335875], 0, 13.555224657058716, 1615558641.2142456], "version": 0.2, "tvm_version": "0.8.dev0"}
{"input": ["opencl -keys=kmppa,opencl,gpu -device=kmppa -max_num_threads=16", "conv2d_ttile_", [1, 56, 56, 128, 128, 3, 3, 1, 1, 1, 1, 1, 1], {}], "config": {"index": 1117, "code_hash": null, "entity": [["tile_in_channels", "ot", 32], ["tile_out_channels", "ot", 8], ["tile_xx", "ot", 2], ["tile_yy", "ot", 4]]}, "result": [[0.106057810425, 0.10608925437500001], 0, 10.673093318939209, 1615558654.3477569], "version": 0.2, "tvm_version": "0.8.dev0"}
{"input": ["opencl -keys=kmppa,opencl,gpu -device=kmppa -max_num_threads=16", "conv2d_ttile_", [1, 56, 56, 128, 128, 3, 3, 1, 1, 1, 1, 1, 1], {}], "config": {"index": 1187, "code_hash": null, "entity": [["tile_in_channels", "ot", 8], ["tile_out_channels", "ot", 16], ["tile_xx", "ot", 4], ["tile_yy", "ot", 4]]}, "result": [[0.053600307075, 0.053588264675], 0, 7.11914587020874, 1615558664.0133877], "version": 0.2, "tvm_version": "0.8.dev0"}
{"input": ["opencl -keys=kmppa,opencl,gpu -device=kmppa -max_num_threads=16", "conv2d_ttile_", [1, 56, 56, 128, 128, 3, 3, 1, 1, 1, 1, 1, 1], {}], "config": {"index": 1115, "code_hash": null, "entity": [["tile_in_channels", "ot", 8], ["tile_out_channels", "ot", 8], ["tile_xx", "ot", 2], ["tile_yy", "ot", 4]]}, "result": [[0.1059452429, 0.10592516512500001], 0, 10.763623714447021, 1615558740.3205962], "version": 0.2, "tvm_version": "0.8.dev0"}
{"input": ["opencl -keys=kmppa,opencl,gpu -device=kmppa -max_num_threads=16", "conv2d_ttile_", [1, 56, 56, 128, 128, 3, 3, 1, 1, 1, 1, 1, 1], {}], "config": {"index": 1189, "code_hash": null, "entity": [["tile_in_channels", "ot", 32], ["tile_out_channels", "ot", 16], ["tile_xx", "ot", 4], ["tile_yy", "ot", 4]]}, "result": [[0.054753564374999994, 0.054778158825], 0, 7.185241222381592, 1615558752.1533296], "version": 0.2, "tvm_version": "0.8.dev0"}
{"input": ["opencl -keys=kmppa,opencl,gpu -device=kmppa -max_num_threads=16", "conv2d_ttile_", [1, 56, 56, 128, 128, 3, 3, 1, 1, 1, 1, 1, 1], {}], "config": {"index": 1160, "code_hash": null, "entity": [["tile_in_channels", "ot", 1], ["tile_out_channels", "ot", 2], ["tile_xx", "ot", 4], ["tile_yy", "ot", 4]]}, "result": [[0.11180494355, 0.11180855059999999], 0, 11.110506534576416, 1615558765.6682944], "version": 0.2, "tvm_version": "0.8.dev0"}
{"input": ["opencl -keys=kmppa,opencl,gpu -device=kmppa -max_num_threads=16", "conv2d_ttile_", [1, 56, 56, 128, 128, 3, 3, 1, 1, 1, 1, 1, 1], {}], "config": {"index": 1185, "code_hash": null, "entity": [["tile_in_channels", "ot", 2], ["tile_out_channels", "ot", 16], ["tile_xx", "ot", 4], ["tile_yy", "ot", 4]]}, "result": [[0.04907978365, 0.049105474625], 0, 5.539285182952881, 1615558801.4834244], "version": 0.2, "tvm_version": "0.8.dev0"}
{"input": ["opencl -keys=kmppa,opencl,gpu -device=kmppa -max_num_threads=16", "conv2d_ttile_", [1, 56, 56, 128, 128, 3, 3, 1, 1, 1, 1, 1, 1], {}], "config": {"index": 676, "code_hash": null, "entity": [["tile_in_channels", "ot", 16], ["tile_out_channels", "ot", 16], ["tile_xx", "ot", 4], ["tile_yy", "ot", 2]]}, "result": [[0.10314426555, 0.10319490542500001], 0, 11.114096879959106, 1615558833.5725763], "version": 0.2, "tvm_version": "0.8.dev0"}
{"input": ["opencl -keys=kmppa,opencl,gpu -device=kmppa -max_num_threads=16", "conv2d_ttile_", [1, 56, 56, 128, 128, 3, 3, 1, 1, 1, 1, 1, 1], {}], "config": {"index": 1113, "code_hash": null, "entity": [["tile_in_channels", "ot", 2], ["tile_out_channels", "ot", 8], ["tile_xx", "ot", 2], ["tile_yy", "ot", 4]]}, "result": [[0.10218611865, 0.10213902290000001], 0, 10.414857149124146, 1615558848.6375308], "version": 0.2, "tvm_version": "0.8.dev0"}
{"input": ["opencl -keys=kmppa,opencl,gpu -device=kmppa -max_num_threads=16", "conv2d_ttile_", [1, 56, 56, 128, 128, 3, 3, 1, 1, 1, 1, 1, 1], {}], "config": {"index": 2133, "code_hash": null, "entity": [["tile_in_channels", "ot", 32], ["tile_out_channels", "ot", 4], ["tile_xx", "ot", 2], ["tile_yy", "ot", 8]]}, "result": [[0.07559269427500001, 0.07560186085000001], 0, 8.211812019348145, 1615558880.2087836], "version": 0.2, "tvm_version": "0.8.dev0"}
{"input": ["opencl -keys=kmppa,opencl,gpu -device=kmppa -max_num_threads=16", "conv2d_ttile_", [1, 56, 56, 128, 128, 3, 3, 1, 1, 1, 1, 1, 1], {}], "config": {"index": 1628, "code_hash": null, "entity": [["tile_in_channels", "ot", 16], ["tile_out_channels", "ot", 8], ["tile_xx", "ot", 2], ["tile_yy", "ot", 7]]}, "result": [[0.062723371475, 0.06267063442500001], 0, 7.230792045593262, 1615558890.027005], "version": 0.2, "tvm_version": "0.8.dev0"}
{"input": ["opencl -keys=kmppa,opencl,gpu -device=kmppa -max_num_threads=16", "conv2d_ttile_", [1, 56, 56, 128, 128, 3, 3, 1, 1, 1, 1, 1, 1], {}], "config": {"index": 1126, "code_hash": null, "entity": [["tile_in_channels", "ot", 64], ["tile_out_channels", "ot", 16], ["tile_xx", "ot", 2], ["tile_yy", "ot", 4]]}, "result": [[0.07931334412499999, 0.07929147155], 0, 9.257215738296509, 1615558918.0520556], "version": 0.2, "tvm_version": "0.8.dev0"}
{"input": ["opencl -keys=kmppa,opencl,gpu -device=kmppa -max_num_threads=16", "conv2d_ttile_", [1, 56, 56, 128, 128, 3, 3, 1, 1, 1, 1, 1, 1], {}], "config": {"index": 1619, "code_hash": null, "entity": [["tile_in_channels", "ot", 8], ["tile_out_channels", "ot", 4], ["tile_xx", "ot", 2], ["tile_yy", "ot", 7]]}, "result": [[0.0741390556, 0.074139347125], 0, 8.207269191741943, 1615558933.5600803], "version": 0.2, "tvm_version": "0.8.dev0"}
{"input": ["opencl -keys=kmppa,opencl,gpu -device=kmppa -max_num_threads=16", "conv2d_ttile_", [1, 56, 56, 128, 128, 3, 3, 1, 1, 1, 1, 1, 1], {}], "config": {"index": 2131, "code_hash": null, "entity": [["tile_in_channels", "ot", 8], ["tile_out_channels", "ot", 4], ["tile_xx", "ot", 2], ["tile_yy", "ot", 8]]}, "result": [[0.06676519882500001, 0.066820697975], 0, 7.651827573776245, 1615558967.571311], "version": 0.2, "tvm_version": "0.8.dev0"}
{"input": ["opencl -keys=kmppa,opencl,gpu -device=kmppa -max_num_threads=16", "conv2d_ttile_", [1, 56, 56, 128, 128, 3, 3, 1, 1, 1, 1, 1, 1], {}], "config": {"index": 2151, "code_hash": null, "entity": [["tile_in_channels", "ot", 128], ["tile_out_channels", "ot", 16], ["tile_xx", "ot", 2], ["tile_yy", "ot", 8]]}, "result": [[0.0441721964, 0.04417053415], 0, 6.263996839523315, 1615558980.7167583], "version": 0.2, "tvm_version": "0.8.dev0"}
{"input": ["opencl -keys=kmppa,opencl,gpu -device=kmppa -max_num_threads=16", "conv2d_ttile_", [1, 56, 56, 128, 128, 3, 3, 1, 1, 1, 1, 1, 1], {}], "config": {"index": 2140, "code_hash": null, "entity": [["tile_in_channels", "ot", 16], ["tile_out_channels", "ot", 8], ["tile_xx", "ot", 2], ["tile_yy", "ot", 8]]}, "result": [[0.0565716223, 0.056570585124999996], 0, 6.72254490852356, 1615558996.7383096], "version": 0.2, "tvm_version": "0.8.dev0"}
{"input": ["opencl -keys=kmppa,opencl,gpu -device=kmppa -max_num_threads=16", "conv2d_ttile_", [1, 56, 56, 128, 128, 3, 3, 1, 1, 1, 1, 1, 1], {}], "config": {"index": 2150, "code_hash": null, "entity": [["tile_in_channels", "ot", 64], ["tile_out_channels", "ot", 16], ["tile_xx", "ot", 2], ["tile_yy", "ot", 8]]}, "result": [[0.0424104722, 0.042380360175], 0, 6.155281066894531, 1615559021.5620625], "version": 0.2, "tvm_version": "0.8.dev0"}
{"input": ["opencl -keys=kmppa,opencl,gpu -device=kmppa -max_num_threads=16", "conv2d_ttile_", [1, 56, 56, 128, 128, 3, 3, 1, 1, 1, 1, 1, 1], {}], "config": {"index": 2132, "code_hash": null, "entity": [["tile_in_channels", "ot", 16], ["tile_out_channels", "ot", 4], ["tile_xx", "ot", 2], ["tile_yy", "ot", 8]]}, "result": [[0.075588112575, 0.075628688425], 0, 8.22326397895813, 1615559037.0975256], "version": 0.2, "tvm_version": "0.8.dev0"}
{"input": ["opencl -keys=kmppa,opencl,gpu -device=kmppa -max_num_threads=16", "conv2d_ttile_", [1, 56, 56, 128, 128, 3, 3, 1, 1, 1, 1, 1, 1], {}], "config": {"index": 1182, "code_hash": null, "entity": [["tile_in_channels", "ot", 64], ["tile_out_channels", "ot", 8], ["tile_xx", "ot", 4], ["tile_yy", "ot", 4]]}, "result": [[0.064999288175, 0.06506037810000001], 0, 7.345736265182495, 1615559063.404333], "version": 0.2, "tvm_version": "0.8.dev0"}
{"input": ["opencl -keys=kmppa,opencl,gpu -device=kmppa -max_num_threads=16", "conv2d_ttile_", [1, 56, 56, 128, 128, 3, 3, 1, 1, 1, 1, 1, 1], {}], "config": {"index": 1191, "code_hash": null, "entity": [["tile_in_channels", "ot", 128], ["tile_out_channels", "ot", 16], ["tile_xx", "ot", 4], ["tile_yy", "ot", 4]]}, "result": [[0.05462493385, 0.054636681099999994], 0, 7.114206552505493, 1615559073.0893445], "version": 0.2, "tvm_version": "0.8.dev0"}
{"input": ["opencl -keys=kmppa,opencl,gpu -device=kmppa -max_num_threads=16", "conv2d_ttile_", [1, 56, 56, 128, 128, 3, 3, 1, 1, 1, 1, 1, 1], {}], "config": {"index": 667, "code_hash": null, "entity": [["tile_in_channels", "ot", 8], ["tile_out_channels", "ot", 8], ["tile_xx", "ot", 4], ["tile_yy", "ot", 2]]}, "result": [[0.11955633937500001, 0.1196181364], 0, 11.832416772842407, 1615559091.8268385], "version": 0.2, "tvm_version": "0.8.dev0"}
{"input": ["opencl -keys=kmppa,opencl,gpu -device=kmppa -max_num_threads=16", "conv2d_ttile_", [1, 56, 56, 128, 128, 3, 3, 1, 1, 1, 1, 1, 1], {}], "config": {"index": 1184, "code_hash": null, "entity": [["tile_in_channels", "ot", 1], ["tile_out_channels", "ot", 16], ["tile_xx", "ot", 4], ["tile_yy", "ot", 4]]}, "result": [[0.04709661725, 0.0471469412], 0, 6.51015567779541, 1615559100.7658472], "version": 0.2, "tvm_version": "0.8.dev0"}
{"input": ["opencl -keys=kmppa,opencl,gpu -device=kmppa -max_num_threads=16", "conv2d_ttile_", [1, 56, 56, 128, 128, 3, 3, 1, 1, 1, 1, 1, 1], {}], "config": {"index": 1633, "code_hash": null, "entity": [["tile_in_channels", "ot", 2], ["tile_out_channels", "ot", 16], ["tile_xx", "ot", 2], ["tile_yy", "ot", 7]]}, "result": [[0.046703254525, 0.046675721399999995], 0, 6.684772491455078, 1615559130.7905102], "version": 0.2, "tvm_version": "0.8.dev0"}
{"input": ["opencl -keys=kmppa,opencl,gpu -device=kmppa -max_num_threads=16", "conv2d_ttile_", [1, 56, 56, 128, 128, 3, 3, 1, 1, 1, 1, 1, 1], {}], "config": {"index": 675, "code_hash": null, "entity": [["tile_in_channels", "ot", 8], ["tile_out_channels", "ot", 16], ["tile_xx", "ot", 4], ["tile_yy", "ot", 2]]}, "result": [[0.10171654875, 0.10171846582499999], 0, 10.985618591308594, 1615559165.1447577], "version": 0.2, "tvm_version": "0.8.dev0"}
{"input": ["opencl -keys=kmppa,opencl,gpu -device=kmppa -max_num_threads=16", "conv2d_ttile_", [1, 56, 56, 128, 128, 3, 3, 1, 1, 1, 1, 1, 1], {}], "config": {"index": 1190, "code_hash": null, "entity": [["tile_in_channels", "ot", 64], ["tile_out_channels", "ot", 16], ["tile_xx", "ot", 4], ["tile_yy", "ot", 4]]}, "result": [[0.05454088042500001, 0.054564710174999996], 0, 7.136964321136475, 1615559195.670805], "version": 0.2, "tvm_version": "0.8.dev0"}
{"input": ["opencl -keys=kmppa,opencl,gpu -device=kmppa -max_num_threads=16", "conv2d_ttile_", [1, 56, 56, 128, 128, 3, 3, 1, 1, 1, 1, 1, 1], {}], "config": {"index": 1630, "code_hash": null, "entity": [["tile_in_channels", "ot", 64], ["tile_out_channels", "ot", 8], ["tile_xx", "ot", 2], ["tile_yy", "ot", 7]]}, "result": [[0.063496067025, 0.063535544625], 0, 7.234474182128906, 1615559207.5345814], "version": 0.2, "tvm_version": "0.8.dev0"}
{"input": ["opencl -keys=kmppa,opencl,gpu -device=kmppa -max_num_threads=16", "conv2d_ttile_", [1, 56, 56, 128, 128, 3, 3, 1, 1, 1, 1, 1, 1], {}], "config": {"index": 1114, "code_hash": null, "entity": [["tile_in_channels", "ot", 4], ["tile_out_channels", "ot", 8], ["tile_xx", "ot", 2], ["tile_yy", "ot", 4]]}, "result": [[0.097768601025, 0.09776028810000001], 0, 10.068454027175903, 1615559224.9043965], "version": 0.2, "tvm_version": "0.8.dev0"}
{"input": ["opencl -keys=kmppa,opencl,gpu -device=kmppa -max_num_threads=16", "conv2d_ttile_", [1, 56, 56, 128, 128, 3, 3, 1, 1, 1, 1, 1, 1], {}], "config": {"index": 1186, "code_hash": null, "entity": [["tile_in_channels", "ot", 4], ["tile_out_channels", "ot", 16], ["tile_xx", "ot", 4], ["tile_yy", "ot", 4]]}, "result": [[0.051635623500000005, 0.051619065925], 0, 6.9891557693481445, 1615559297.7979488], "version": 0.2, "tvm_version": "0.8.dev0"}
{"input": ["opencl -keys=kmppa,opencl,gpu -device=kmppa -max_num_threads=16", "conv2d_ttile_", [1, 56, 56, 128, 128, 3, 3, 1, 1, 1, 1, 1, 1], {}], "config": {"index": 2148, "code_hash": null, "entity": [["tile_in_channels", "ot", 16], ["tile_out_channels", "ot", 16], ["tile_xx", "ot", 2], ["tile_yy", "ot", 8]]}, "result": [[0.0446907074, 0.044666654125], 0, 6.36193585395813, 1615559308.8129299], "version": 0.2, "tvm_version": "0.8.dev0"}
{"input": ["opencl -keys=kmppa,opencl,gpu -device=kmppa -max_num_threads=16", "conv2d_ttile_", [1, 56, 56, 128, 128, 3, 3, 1, 1, 1, 1, 1, 1], {}], "config": {"index": 1127, "code_hash": null, "entity": [["tile_in_channels", "ot", 128], ["tile_out_channels", "ot", 16], ["tile_xx", "ot", 2], ["tile_yy", "ot", 4]]}, "result": [[0.082311805775, 0.082330502175], 0, 9.33086609840393, 1615559353.4364076], "version": 0.2, "tvm_version": "0.8.dev0"}
{"input": ["opencl -keys=kmppa,opencl,gpu -device=kmppa -max_num_threads=16", "conv2d_ttile_", [1, 56, 56, 128, 128, 3, 3, 1, 1, 1, 1, 1, 1], {}], "config": {"index": 2146, "code_hash": null, "entity": [["tile_in_channels", "ot", 4], ["tile_out_channels", "ot", 16], ["tile_xx", "ot", 2], ["tile_yy", "ot", 8]]}, "result": [[0.044589051525, 0.044511847425], 0, 6.376642227172852, 1615559381.073843], "version": 0.2, "tvm_version": "0.8.dev0"}
{"input": ["opencl -keys=kmppa,opencl,gpu -device=kmppa -max_num_threads=16", "conv2d_ttile_", [1, 56, 56, 128, 128, 3, 3, 1, 1, 1, 1, 1, 1], {}], "config": {"index": 1120, "code_hash": null, "entity": [["tile_in_channels", "ot", 1], ["tile_out_channels", "ot", 16], ["tile_xx", "ot", 2], ["tile_yy", "ot", 4]]}, "result": [[0.0776291341, 0.07760277777499999], 0, 8.96437120437622, 1615559411.182969], "version": 0.2, "tvm_version": "0.8.dev0"}
{"input": ["opencl -keys=kmppa,opencl,gpu -device=kmppa -max_num_threads=16", "conv2d_ttile_", [1, 56, 56, 128, 128, 3, 3, 1, 1, 1, 1, 1, 1], {}], "config": {"index": 1162, "code_hash": null, "entity": [["tile_in_channels", "ot", 4], ["tile_out_channels", "ot", 2], ["tile_xx", "ot", 4], ["tile_yy", "ot", 4]]}, "result": [[0.11424597962500001, 0.11424095975], 0, 11.443603038787842, 1615559492.661936], "version": 0.2, "tvm_version": "0.8.dev0"}
{"input": ["opencl -keys=kmppa,opencl,gpu -device=kmppa -max_num_threads=16", "conv2d_ttile_", [1, 56, 56, 128, 128, 3, 3, 1, 1, 1, 1, 1, 1], {}], "config": {"index": 657, "code_hash": null, "entity": [["tile_in_channels", "ot", 2], ["tile_out_channels", "ot", 4], ["tile_xx", "ot", 4], ["tile_yy", "ot", 2]]}, "result": [[0.13301235915, 0.13296203685000002], 0, 12.933777093887329, 1615559510.4958506], "version": 0.2, "tvm_version": "0.8.dev0"}
{"input": ["opencl -keys=kmppa,opencl,gpu -device=kmppa -max_num_threads=16", "conv2d_ttile_", [1, 56, 56, 128, 128, 3, 3, 1, 1, 1, 1, 1, 1], {}], "config": {"index": 2138, "code_hash": null, "entity": [["tile_in_channels", "ot", 4], ["tile_out_channels", "ot", 8], ["tile_xx", "ot", 2], ["tile_yy", "ot", 8]]}, "result": [[0.05302911365, 0.0530156186], 0, 6.55756139755249, 1615559552.123663], "version": 0.2, "tvm_version": "0.8.dev0"}
{"input": ["opencl -keys=kmppa,opencl,gpu -device=kmppa -max_num_threads=16", "conv2d_ttile_", [1, 56, 56, 128, 128, 3, 3, 1, 1, 1, 1, 1, 1], {}], "config": {"index": 1638, "code_hash": null, "entity": [["tile_in_channels", "ot", 64], ["tile_out_channels", "ot", 16], ["tile_xx", "ot", 2], ["tile_yy", "ot", 7]]}, "result": [[0.046890783575, 0.046881349775], 0, 6.530219316482544, 1615559565.9828897], "version": 0.2, "tvm_version": "0.8.dev0"}
{"input": ["opencl -keys=kmppa,opencl,gpu -device=kmppa -max_num_threads=16", "conv2d_ttile_", [1, 56, 56, 128, 128, 3, 3, 1, 1, 1, 1, 1, 1], {}], "config": {"index": 1122, "code_hash": null, "entity": [["tile_in_channels", "ot", 4], ["tile_out_channels", "ot", 16], ["tile_xx", "ot", 2], ["tile_yy", "ot", 4]]}, "result": [[0.082735255, 0.08275295795], 0, 9.42989706993103, 1615559622.1996613], "version": 0.2, "tvm_version": "0.8.dev0"}
{"input": ["opencl -keys=kmppa,opencl,gpu -device=kmppa -max_num_threads=16", "conv2d_ttile_", [1, 56, 56, 128, 128, 3, 3, 1, 1, 1, 1, 1, 1], {}], "config": {"index": 2149, "code_hash": null, "entity": [["tile_in_channels", "ot", 32], ["tile_out_channels", "ot", 16], ["tile_xx", "ot", 2], ["tile_yy", "ot", 8]]}, "result": [[0.044644669975, 0.0446277894], 0, 6.334249973297119, 1615559640.4549623], "version": 0.2, "tvm_version": "0.8.dev0"}
{"input": ["opencl -keys=kmppa,opencl,gpu -device=kmppa -max_num_threads=16", "conv2d_ttile_", [1, 56, 56, 128, 128, 3, 3, 1, 1, 1, 1, 1, 1], {}], "config": {"index": 2145, "code_hash": null, "entity": [["tile_in_channels", "ot", 2], ["tile_out_channels", "ot", 16], ["tile_xx", "ot", 2], ["tile_yy", "ot", 8]]}, "result": [[0.041980645175, 0.041980863425], 0, 6.107305288314819, 1615559649.0056384], "version": 0.2, "tvm_version": "0.8.dev0"}
{"input": ["opencl -keys=kmppa,opencl,gpu -device=kmppa -max_num_threads=16", "conv2d_ttile_", [1, 56, 56, 128, 128, 3, 3, 1, 1, 1, 1, 1, 1], {}], "config": {"index": 2143, "code_hash": null, "entity": [["tile_in_channels", "ot", 128], ["tile_out_channels", "ot", 8], ["tile_xx", "ot", 2], ["tile_yy", "ot", 8]]}, "result": [[0.057287141625, 0.057299575075], 0, 6.7498040199279785, 1615559660.4841495], "version": 0.2, "tvm_version": "0.8.dev0"}
{"input": ["opencl -keys=kmppa,opencl,gpu -device=kmppa -max_num_threads=16", "conv2d_ttile_", [1, 56, 56, 128, 128, 3, 3, 1, 1, 1, 1, 1, 1], {}], "config": {"index": 2137, "code_hash": null, "entity": [["tile_in_channels", "ot", 2], ["tile_out_channels", "ot", 8], ["tile_xx", "ot", 2], ["tile_yy", "ot", 8]]}, "result": [[0.05520036545, 0.055231795674999994], 0, 6.543900966644287, 1615559674.0576632], "version": 0.2, "tvm_version": "0.8.dev0"}
{"input": ["opencl -keys=kmppa,opencl,gpu -device=kmppa -max_num_threads=16", "conv2d_ttile_", [1, 56, 56, 128, 128, 3, 3, 1, 1, 1, 1, 1, 1], {}], "config": {"index": 1634, "code_hash": null, "entity": [["tile_in_channels", "ot", 4], ["tile_out_channels", "ot", 16], ["tile_xx", "ot", 2], ["tile_yy", "ot", 7]]}, "result": [[0.04939400405, 0.049438295524999995], 0, 6.771677494049072, 1615559685.864484], "version": 0.2, "tvm_version": "0.8.dev0"}
{"input": ["opencl -keys=kmppa,opencl,gpu -device=kmppa -max_num_threads=16", "conv2d_ttile_", [1, 56, 56, 128, 128, 3, 3, 1, 1, 1, 1, 1, 1], {}], "config": {"index": 1639, "code_hash": null, "entity": [["tile_in_channels", "ot", 128], ["tile_out_channels", "ot", 16], ["tile_xx", "ot", 2], ["tile_yy", "ot", 7]]}, "result": [[0.0489484563, 0.048973342399999995], 0, 6.647931098937988, 1615559723.283837], "version": 0.2, "tvm_version": "0.8.dev0"}
{"input": ["opencl -keys=kmppa,opencl,gpu -device=kmppa -max_num_threads=16", "conv2d_ttile_", [1, 56, 56, 128, 128, 3, 3, 1, 1, 1, 1, 1, 1], {}], "config": {"index": 1622, "code_hash": null, "entity": [["tile_in_channels", "ot", 64], ["tile_out_channels", "ot", 4], ["tile_xx", "ot", 2], ["tile_yy", "ot", 7]]}, "result": [[0.08391847890000001, 0.0839223708], 0, 8.810564517974854, 1615559753.2866335], "version": 0.2, "tvm_version": "0.8.dev0"}
{"input": ["opencl -keys=kmppa,opencl,gpu -device=kmppa -max_num_threads=16", "conv2d_ttile_", [1, 56, 56, 128, 128, 3, 3, 1, 1, 1, 1, 1, 1], {}], "config": {"index": 2136, "code_hash": null, "entity": [["tile_in_channels", "ot", 1], ["tile_out_channels", "ot", 8], ["tile_xx", "ot", 2], ["tile_yy", "ot", 8]]}, "result": [[0.054769714625, 0.054763950974999996], 0, 5.213800668716431, 1615559760.887065], "version": 0.2, "tvm_version": "0.8.dev0"}
{"input": ["opencl -keys=kmppa,opencl,gpu -device=kmppa -max_num_threads=16", "conv2d_ttile_", [1, 56, 56, 128, 128, 3, 3, 1, 1, 1, 1, 1, 1], {}], "config": {"index": 2144, "code_hash": null, "entity": [["tile_in_channels", "ot", 1], ["tile_out_channels", "ot", 16], ["tile_xx", "ot", 2], ["tile_yy", "ot", 8]]}, "result": [[0.0418387557, 0.041766608125], 0, 6.074456214904785, 1615559769.443289], "version": 0.2, "tvm_version": "0.8.dev0"}
{"input": ["opencl -keys=kmppa,opencl,gpu -device=kmppa -max_num_threads=16", "conv2d_ttile_", [1, 56, 56, 128, 128, 3, 3, 1, 1, 1, 1, 1, 1], {}], "config": {"index": 2147, "code_hash": null, "entity": [["tile_in_channels", "ot", 8], ["tile_out_channels", "ot", 16], ["tile_xx", "ot", 2], ["tile_yy", "ot", 8]]}, "result": [[0.0447456501, 0.0447131752], 0, 6.353107929229736, 1615559792.582117], "version": 0.2, "tvm_version": "0.8.dev0"}
{"input": ["opencl -keys=kmppa,opencl,gpu -device=kmppa -max_num_threads=16", "conv2d_ttile_", [1, 56, 56, 128, 128, 3, 3, 1, 1, 1, 1, 1, 1], {}], "config": {"index": 1125, "code_hash": null, "entity": [["tile_in_channels", "ot", 32], ["tile_out_channels", "ot", 16], ["tile_xx", "ot", 2], ["tile_yy", "ot", 4]]}, "result": [[0.083114997375, 0.0831136934], 0, 9.501039505004883, 1615559839.5121477], "version": 0.2, "tvm_version": "0.8.dev0"}
{"input": ["opencl -keys=kmppa,opencl,gpu -device=kmppa -max_num_threads=16", "conv2d_ttile_", [1, 56, 56, 128, 128, 3, 3, 1, 1, 1, 1, 1, 1], {}], "config": {"index": 2124, "code_hash": null, "entity": [["tile_in_channels", "ot", 16], ["tile_out_channels", "ot", 2], ["tile_xx", "ot", 2], ["tile_yy", "ot", 8]]}, "result": [[0.12968217165, 0.12963796235], 0, 12.625986814498901, 1615559873.2665427], "version": 0.2, "tvm_version": "0.8.dev0"}
{"input": ["opencl -keys=kmppa,opencl,gpu -device=kmppa -max_num_threads=16", "conv2d_ttile_", [1, 56, 56, 128, 128, 3, 3, 1, 1, 1, 1, 1, 1], {}], "config": {"index": 2127, "code_hash": null, "entity": [["tile_in_channels", "ot", 128], ["tile_out_channels", "ot", 2], ["tile_xx", "ot", 2], ["tile_yy", "ot", 8]]}, "result": [[0.128469809675, 0.128467594425], 0, 12.4625244140625, 1615559906.7669353], "version": 0.2, "tvm_version": "0.8.dev0"}
{"input": ["opencl -keys=kmppa,opencl,gpu -device=kmppa -max_num_threads=16", "conv2d_ttile_", [1, 56, 56, 128, 128, 3, 3, 1, 1, 1, 1, 1, 1], {}], "config": {"index": 2069, "code_hash": null, "entity": [["tile_in_channels", "ot", 32], ["tile_out_channels", "ot", 4], ["tile_xx", "ot", 1], ["tile_yy", "ot", 8]]}, "result": [[0.14242695705, 0.142415143475], 0, 13.611177206039429, 1615559946.5653763], "version": 0.2, "tvm_version": "0.8.dev0"}
{"input": ["opencl -keys=kmppa,opencl,gpu -device=kmppa -max_num_threads=16", "conv2d_ttile_", [1, 56, 56, 128, 128, 3, 3, 1, 1, 1, 1, 1, 1], {}], "config": {"index": 2072, "code_hash": null, "entity": [["tile_in_channels", "ot", 1], ["tile_out_channels", "ot", 8], ["tile_xx", "ot", 1], ["tile_yy", "ot", 8]]}, "result": [[0.091418039625, 0.09147293875], 0, 9.686911582946777, 1615559967.9763029], "version": 0.2, "tvm_version": "0.8.dev0"}
{"input": ["opencl -keys=kmppa,opencl,gpu -device=kmppa -max_num_threads=16", "conv2d_ttile_", [1, 56, 56, 128, 128, 3, 3, 1, 1, 1, 1, 1, 1], {}], "config": {"index": 2081, "code_hash": null, "entity": [["tile_in_channels", "ot", 2], ["tile_out_channels", "ot", 16], ["tile_xx", "ot", 1], ["tile_yy", "ot", 8]]}, "result": [[0.070405871725, 0.0704260009], 0, 8.388374328613281, 1615559978.8317468], "version": 0.2, "tvm_version": "0.8.dev0"}
{"input": ["opencl -keys=kmppa,opencl,gpu -device=kmppa -max_num_threads=16", "conv2d_ttile_", [1, 56, 56, 128, 128, 3, 3, 1, 1, 1, 1, 1, 1], {}], "config": {"index": 802, "code_hash": null, "entity": [["tile_in_channels", "ot", 4], ["tile_out_channels", "ot", 16], ["tile_xx", "ot", 8], ["tile_yy", "ot", 2]]}, "result": [[0.0835369916, 0.08347805675], 0, 9.513370037078857, 1615559990.7533176], "version": 0.2, "tvm_version": "0.8.dev0"}
{"input": ["opencl -keys=kmppa,opencl,gpu -device=kmppa -max_num_threads=16", "conv2d_ttile_", [1, 56, 56, 128, 128, 3, 3, 1, 1, 1, 1, 1, 1], {}], "config": {"index": 2082, "code_hash": null, "entity": [["tile_in_channels", "ot", 4], ["tile_out_channels", "ot", 16], ["tile_xx", "ot", 1], ["tile_yy", "ot", 8]]}, "result": [[0.07129540525, 0.07128929510000001], 0, 7.121927738189697, 1615560002.518228], "version": 0.2, "tvm_version": "0.8.dev0"}
{"input": ["opencl -keys=kmppa,opencl,gpu -device=kmppa -max_num_threads=16", "conv2d_ttile_", [1, 56, 56, 128, 128, 3, 3, 1, 1, 1, 1, 1, 1], {}], "config": {"index": 2066, "code_hash": null, "entity": [["tile_in_channels", "ot", 4], ["tile_out_channels", "ot", 4], ["tile_xx", "ot", 1], ["tile_yy", "ot", 8]]}, "result": [[0.128215749125, 0.12823093889999998], 0, 12.50427532196045, 1615560017.3463066], "version": 0.2, "tvm_version": "0.8.dev0"}
{"input": ["opencl -keys=kmppa,opencl,gpu -device=kmppa -max_num_threads=16", "conv2d_ttile_", [1, 56, 56, 128, 128, 3, 3, 1, 1, 1, 1, 1, 1], {}], "config": {"index": 1123, "code_hash": null, "entity": [["tile_in_channels", "ot", 8], ["tile_out_channels", "ot", 16], ["tile_xx", "ot", 2], ["tile_yy", "ot", 4]]}, "result": [[0.0830554102, 0.083049378475], 0, 9.496842384338379, 1615560047.6313558], "version": 0.2, "tvm_version": "0.8.dev0"}
{"input": ["opencl -keys=kmppa,opencl,gpu -device=kmppa -max_num_threads=16", "conv2d_ttile_", [1, 56, 56, 128, 128, 3, 3, 1, 1, 1, 1, 1, 1], {}], "config": {"index": 2125, "code_hash": null, "entity": [["tile_in_channels", "ot", 32], ["tile_out_channels", "ot", 2], ["tile_xx", "ot", 2], ["tile_yy", "ot", 8]]}, "result": [[0.12960278935, 0.129563903], 0, 12.561799049377441, 1615560062.765434], "version": 0.2, "tvm_version": "0.8.dev0"}
{"input": ["opencl -keys=kmppa,opencl,gpu -device=kmppa -max_num_threads=16", "conv2d_ttile_", [1, 56, 56, 128, 128, 3, 3, 1, 1, 1, 1, 1, 1], {}], "config": {"index": 2135, "code_hash": null, "entity": [["tile_in_channels", "ot", 128], ["tile_out_channels", "ot", 4], ["tile_xx", "ot", 2], ["tile_yy", "ot", 8]]}, "result": [[0.07560858872500001, 0.07561858057500001], 0, 8.215434074401855, 1615560112.8450024], "version": 0.2, "tvm_version": "0.8.dev0"}
{"input": ["opencl -keys=kmppa,opencl,gpu -device=kmppa -max_num_threads=16", "conv2d_ttile_", [1, 56, 56, 128, 128, 3, 3, 1, 1, 1, 1, 1, 1], {}], "config": {"index": 1629, "code_hash": null, "entity": [["tile_in_channels", "ot", 32], ["tile_out_channels", "ot", 8], ["tile_xx", "ot", 2], ["tile_yy", "ot", 7]]}, "result": [[0.06276587365, 0.06278767589999999], 0, 7.200876712799072, 1615560159.9401412], "version": 0.2, "tvm_version": "0.8.dev0"}
{"input": ["opencl -keys=kmppa,opencl,gpu -device=kmppa -max_num_threads=16", "conv2d_ttile_", [1, 56, 56, 128, 128, 3, 3, 1, 1, 1, 1, 1, 1], {}], "config": {"index": 1615, "code_hash": null, "entity": [["tile_in_channels", "ot", 128], ["tile_out_channels", "ot", 2], ["tile_xx", "ot", 2], ["tile_yy", "ot", 7]]}, "result": [[0.143640700375, 0.14365167205], 0, 13.650516033172607, 1615560201.4986768], "version": 0.2, "tvm_version": "0.8.dev0"}
{"input": ["opencl -keys=kmppa,opencl,gpu -device=kmppa -max_num_threads=16", "conv2d_ttile_", [1, 56, 56, 128, 128, 3, 3, 1, 1, 1, 1, 1, 1], {}], "config": {"index": 1635, "code_hash": null, "entity": [["tile_in_channels", "ot", 8], ["tile_out_channels", "ot", 16], ["tile_xx", "ot", 2], ["tile_yy", "ot", 7]]}, "result": [[0.04958297225, 0.049621134974999995], 0, 6.8112452030181885, 1615560215.17055], "version": 0.2, "tvm_version": "0.8.dev0"}
{"input": ["opencl -keys=kmppa,opencl,gpu -device=kmppa -max_num_threads=16", "conv2d_ttile_", [1, 56, 56, 128, 128, 3, 3, 1, 1, 1, 1, 1, 1], {}], "config": {"index": 1063, "code_hash": null, "entity": [["tile_in_channels", "ot", 128], ["tile_out_channels", "ot", 16], ["tile_xx", "ot", 1], ["tile_yy", "ot", 4]]}, "result": [[0.127671113525, 0.127699478], 0, 12.938517093658447, 1615560246.7129986], "version": 0.2, "tvm_version": "0.8.dev0"}
{"input": ["opencl -keys=kmppa,opencl,gpu -device=kmppa -max_num_threads=16", "conv2d_ttile_", [1, 56, 56, 128, 128, 3, 3, 1, 1, 1, 1, 1, 1], {}], "config": {"index": 2130, "code_hash": null, "entity": [["tile_in_channels", "ot", 4], ["tile_out_channels", "ot", 4], ["tile_xx", "ot", 2], ["tile_yy", "ot", 8]]}, "result": [[0.069726445925, 0.069775727175], 0, 7.740320444107056, 1615560256.9640827], "version": 0.2, "tvm_version": "0.8.dev0"}
{"input": ["opencl -keys=kmppa,opencl,gpu -device=kmppa -max_num_threads=16", "conv2d_ttile_", [1, 56, 56, 128, 128, 3, 3, 1, 1, 1, 1, 1, 1], {}], "config": {"index": 1626, "code_hash": null, "entity": [["tile_in_channels", "ot", 4], ["tile_out_channels", "ot", 8], ["tile_xx", "ot", 2], ["tile_yy", "ot", 7]]}, "result": [[0.0587722995, 0.058735293825], 0, 6.9385411739349365, 1615560266.3499794], "version": 0.2, "tvm_version": "0.8.dev0"}
{"input": ["opencl -keys=kmppa,opencl,gpu -device=kmppa -max_num_threads=16", "conv2d_ttile_", [1, 56, 56, 128, 128, 3, 3, 1, 1, 1, 1, 1, 1], {}], "config": {"index": 1573, "code_hash": null, "entity": [["tile_in_channels", "ot", 32], ["tile_out_channels", "ot", 16], ["tile_xx", "ot", 1], ["tile_yy", "ot", 7]]}, "result": [[0.079239688275, 0.07921633805], 0, 9.072813749313354, 1615560279.960073], "version": 0.2, "tvm_version": "0.8.dev0"}
{"input": ["opencl -keys=kmppa,opencl,gpu -device=kmppa -max_num_threads=16", "conv2d_ttile_", [1, 56, 56, 128, 128, 3, 3, 1, 1, 1, 1, 1, 1], {}], "config": {"index": 2129, "code_hash": null, "entity": [["tile_in_channels", "ot", 2], ["tile_out_channels", "ot", 4], ["tile_xx", "ot", 2], ["tile_yy", "ot", 8]]}, "result": [[0.068702507275, 0.06872400045], 0, 7.671088695526123, 1615560294.7970617], "version": 0.2, "tvm_version": "0.8.dev0"}
{"input": ["opencl -keys=kmppa,opencl,gpu -device=kmppa -max_num_threads=16", "conv2d_ttile_", [1, 56, 56, 128, 128, 3, 3, 1, 1, 1, 1, 1, 1], {}], "config": {"index": 1569, "code_hash": null, "entity": [["tile_in_channels", "ot", 2], ["tile_out_channels", "ot", 16], ["tile_xx", "ot", 1], ["tile_yy", "ot", 7]]}, "result": [[0.079363064825, 0.079410652325], 0, 9.157431602478027, 1615560308.7409058], "version": 0.2, "tvm_version": "0.8.dev0"}
{"input": ["opencl -keys=kmppa,opencl,gpu -device=kmppa -max_num_threads=16", "conv2d_ttile_", [1, 56, 56, 128, 128, 3, 3, 1, 1, 1, 1, 1, 1], {}], "config": {"index": 2594, "code_hash": null, "entity": [["tile_in_channels", "ot", 4], ["tile_out_channels", "ot", 16], ["tile_xx", "ot", 1], ["tile_yy", "ot", 14]]}, "result": [[0.048858974925, 0.04884236475], 0, 6.795130252838135, 1615560317.9943624], "version": 0.2, "tvm_version": "0.8.dev0"}
{"input": ["opencl -keys=kmppa,opencl,gpu -device=kmppa -max_num_threads=16", "conv2d_ttile_", [1, 56, 56, 128, 128, 3, 3, 1, 1, 1, 1, 1, 1], {}], "config": {"index": 2141, "code_hash": null, "entity": [["tile_in_channels", "ot", 32], ["tile_out_channels", "ot", 8], ["tile_xx", "ot", 2], ["tile_yy", "ot", 8]]}, "result": [[0.0565732162, 0.056562128700000006], 0, 6.720250606536865, 1615560380.8258944], "version": 0.2, "tvm_version": "0.8.dev0"}
{"input": ["opencl -keys=kmppa,opencl,gpu -device=kmppa -max_num_threads=16", "conv2d_ttile_", [1, 56, 56, 128, 128, 3, 3, 1, 1, 1, 1, 1, 1], {}], "config": {"index": 2086, "code_hash": null, "entity": [["tile_in_channels", "ot", 64], ["tile_out_channels", "ot", 16], ["tile_xx", "ot", 1], ["tile_yy", "ot", 8]]}, "result": [[0.070752406, 0.07076081805], 0, 8.530205726623535, 1615560391.6857595], "version": 0.2, "tvm_version": "0.8.dev0"}
{"input": ["opencl -keys=kmppa,opencl,gpu -device=kmppa -max_num_threads=16", "conv2d_ttile_", [1, 56, 56, 128, 128, 3, 3, 1, 1, 1, 1, 1, 1], {}], "config": {"index": 1571, "code_hash": null, "entity": [["tile_in_channels", "ot", 8], ["tile_out_channels", "ot", 16], ["tile_xx", "ot", 1], ["tile_yy", "ot", 7]]}, "result": [[0.079748969925, 0.079752159475], 0, 9.133171081542969, 1615560405.606228], "version": 0.2, "tvm_version": "0.8.dev0"}
{"input": ["opencl -keys=kmppa,opencl,gpu -device=kmppa -max_num_threads=16", "conv2d_ttile_", [1, 56, 56, 128, 128, 3, 3, 1, 1, 1, 1, 1, 1], {}], "config": {"index": 2593, "code_hash": null, "entity": [["tile_in_channels", "ot", 2], ["tile_out_channels", "ot", 16], ["tile_xx", "ot", 1], ["tile_yy", "ot", 14]]}, "result": [[0.046449903425, 0.046433581424999995], 0, 6.407424449920654, 1615560414.360281], "version": 0.2, "tvm_version": "0.8.dev0"}
{"input": ["opencl -keys=kmppa,opencl,gpu -device=kmppa -max_num_threads=16", "conv2d_ttile_", [1, 56, 56, 128, 128, 3, 3, 1, 1, 1, 1, 1, 1], {}], "config": {"index": 2578, "code_hash": null, "entity": [["tile_in_channels", "ot", 4], ["tile_out_channels", "ot", 4], ["tile_xx", "ot", 1], ["tile_yy", "ot", 14]]}, "result": [[0.077360156625, 0.077357512725], 0, 7.041048049926758, 1615560425.9799309], "version": 0.2, "tvm_version": "0.8.dev0"}
{"input": ["opencl -keys=kmppa,opencl,gpu -device=kmppa -max_num_threads=16", "conv2d_ttile_", [1, 56, 56, 128, 128, 3, 3, 1, 1, 1, 1, 1, 1], {}], "config": {"index": 1632, "code_hash": null, "entity": [["tile_in_channels", "ot", 1], ["tile_out_channels", "ot", 16], ["tile_xx", "ot", 2], ["tile_yy", "ot", 7]]}, "result": [[0.046329352525, 0.04631320685], 0, 6.425692319869995, 1615560434.938318], "version": 0.2, "tvm_version": "0.8.dev0"}
{"input": ["opencl -keys=kmppa,opencl,gpu -device=kmppa -max_num_threads=16", "conv2d_ttile_", [1, 56, 56, 128, 128, 3, 3, 1, 1, 1, 1, 1, 1], {}], "config": {"index": 1637, "code_hash": null, "entity": [["tile_in_channels", "ot", 32], ["tile_out_channels", "ot", 16], ["tile_xx", "ot", 2], ["tile_yy", "ot", 7]]}, "result": [[0.049536189274999996, 0.049518360425000005], 0, 6.76705002784729, 1615560465.3209713], "version": 0.2, "tvm_version": "0.8.dev0"}
{"input": ["opencl -keys=kmppa,opencl,gpu -device=kmppa -max_num_threads=16", "conv2d_ttile_", [1, 56, 56, 128, 128, 3, 3, 1, 1, 1, 1, 1, 1], {}], "config": {"index": 2064, "code_hash": null, "entity": [["tile_in_channels", "ot", 1], ["tile_out_channels", "ot", 4], ["tile_xx", "ot", 1], ["tile_yy", "ot", 8]]}, "result": [[0.1331524419, 0.13314681865], 0, 12.851049661636353, 1615560485.34264], "version": 0.2, "tvm_version": "0.8.dev0"}
{"input": ["opencl -keys=kmppa,opencl,gpu -device=kmppa -max_num_threads=16", "conv2d_ttile_", [1, 56, 56, 128, 128, 3, 3, 1, 1, 1, 1, 1, 1], {}], "config": {"index": 2085, "code_hash": null, "entity": [["tile_in_channels", "ot", 32], ["tile_out_channels", "ot", 16], ["tile_xx", "ot", 1], ["tile_yy", "ot", 8]]}, "result": [[0.070881624825, 0.070894604525], 0, 8.437303304672241, 1615560496.241431], "version": 0.2, "tvm_version": "0.8.dev0"}
{"input": ["opencl -keys=kmppa,opencl,gpu -device=kmppa -max_num_threads=16", "conv2d_ttile_", [1, 56, 56, 128, 128, 3, 3, 1, 1, 1, 1, 1, 1], {}], "config": {"index": 2084, "code_hash": null, "entity": [["tile_in_channels", "ot", 16], ["tile_out_channels", "ot", 16], ["tile_xx", "ot", 1], ["tile_yy", "ot", 8]]}, "result": [[0.07087350995, 0.0708920263], 0, 8.403236389160156, 1615560507.0620787], "version": 0.2, "tvm_version": "0.8.dev0"}
{"input": ["opencl -keys=kmppa,opencl,gpu -device=kmppa -max_num_threads=16", "conv2d_ttile_", [1, 56, 56, 128, 128, 3, 3, 1, 1, 1, 1, 1, 1], {}], "config": {"index": 1625, "code_hash": null, "entity": [["tile_in_channels", "ot", 2], ["tile_out_channels", "ot", 8], ["tile_xx", "ot", 2], ["tile_yy", "ot", 7]]}, "result": [[0.06120914595, 0.061218780325], 0, 7.030252456665039, 1615560523.5474012], "version": 0.2, "tvm_version": "0.8.dev0"}
{"input": ["opencl -keys=kmppa,opencl,gpu -device=kmppa -max_num_threads=16", "conv2d_ttile_", [1, 56, 56, 128, 128, 3, 3, 1, 1, 1, 1, 1, 1], {}], "config": {"index": 2139, "code_hash": null, "entity": [["tile_in_channels", "ot", 8], ["tile_out_channels", "ot", 8], ["tile_xx", "ot", 2], ["tile_yy", "ot", 8]]}, "result": [[0.056695384925, 0.056691306025], 0, 6.77570366859436, 1615560553.6270323], "version": 0.2, "tvm_version": "0.8.dev0"}
{"input": ["opencl -keys=kmppa,opencl,gpu -device=kmppa -max_num_threads=16", "conv2d_ttile_", [1, 56, 56, 128, 128, 3, 3, 1, 1, 1, 1, 1, 1], {}], "config": {"index": 1554, "code_hash": null, "entity": [["tile_in_channels", "ot", 4], ["tile_out_channels", "ot", 4], ["tile_xx", "ot", 1], ["tile_yy", "ot", 7]]}, "result": [[0.145061509, 0.14507267035], 0, 13.840404510498047, 1615560591.202057], "version": 0.2, "tvm_version": "0.8.dev0"}
{"input": ["opencl -keys=kmppa,opencl,gpu -device=kmppa -max_num_threads=16", "conv2d_ttile_", [1, 56, 56, 128, 128, 3, 3, 1, 1, 1, 1, 1, 1], {}], "config": {"index": 1624, "code_hash": null, "entity": [["tile_in_channels", "ot", 1], ["tile_out_channels", "ot", 8], ["tile_xx", "ot", 2], ["tile_yy", "ot", 7]]}, "result": [[0.0605716387, 0.060564616], 0, 7.0027916431427, 1615560600.6791015], "version": 0.2, "tvm_version": "0.8.dev0"}
{"input": ["opencl -keys=kmppa,opencl,gpu -device=kmppa -max_num_threads=16", "conv2d_ttile_", [1, 56, 56, 128, 128, 3, 3, 1, 1, 1, 1, 1, 1], {}], "config": {"index": 2080, "code_hash": null, "entity": [["tile_in_channels", "ot", 1], ["tile_out_channels", "ot", 16], ["tile_xx", "ot", 1], ["tile_yy", "ot", 8]]}, "result": [[0.071284766375, 0.071324313725], 0, 8.40647578239441, 1615560620.4658642], "version": 0.2, "tvm_version": "0.8.dev0"}
{"input": ["opencl -keys=kmppa,opencl,gpu -device=kmppa -max_num_threads=64", "conv2d_ttile_", [1, 56, 56, 128, 128, 3, 3, 1, 1, 1, 1, 1, 1], {}], "config": {"index": 657, "code_hash": null, "entity": [["tile_in_channels", "ot", 2], ["tile_out_channels", "ot", 4], ["tile_xx", "ot", 4], ["tile_yy", "ot", 2]]}, "result": [[0.132999499175, 0.13299303002500001], 0, 11.551459074020386, 1615561499.418815], "version": 0.2, "tvm_version": "0.8.dev0"}
{"input": ["opencl -keys=kmppa,opencl,gpu -device=kmppa -max_num_threads=64", "conv2d_ttile_", [1, 56, 56, 128, 128, 3, 3, 1, 1, 1, 1, 1, 1], {}], "config": {"index": 1161, "code_hash": null, "entity": [["tile_in_channels", "ot", 2], ["tile_out_channels", "ot", 2], ["tile_xx", "ot", 4], ["tile_yy", "ot", 4]]}, "result": [[0.117097431525, 0.117068190675], 0, 10.215802431106567, 1615561516.8292298], "version": 0.2, "tvm_version": "0.8.dev0"}
{"input": ["opencl -keys=kmppa,opencl,gpu -device=kmppa -max_num_threads=64", "conv2d_ttile_", [1, 56, 56, 128, 128, 3, 3, 1, 1, 1, 1, 1, 1], {}], "config": {"index": 2586, "code_hash": null, "entity": [["tile_in_channels", "ot", 4], ["tile_out_channels", "ot", 8], ["tile_xx", "ot", 1], ["tile_yy", "ot", 14]]}, "result": [[0.05820039965, 0.058221764025], 0, 6.894075870513916, 1615561526.1378868], "version": 0.2, "tvm_version": "0.8.dev0"}
{"input": ["opencl -keys=kmppa,opencl,gpu -device=kmppa -max_num_threads=64", "conv2d_ttile_", [1, 56, 56, 128, 128, 3, 3, 1, 1, 1, 1, 1, 1], {}], "config": {"index": 656, "code_hash": null, "entity": [["tile_in_channels", "ot", 1], ["tile_out_channels", "ot", 4], ["tile_xx", "ot", 4], ["tile_yy", "ot", 2]]}, "result": [[0.137163565, 0.137101512775], 0, 13.123275756835938, 1615561612.14731], "version": 0.2, "tvm_version": "0.8.dev0"}
{"input": ["opencl -keys=kmppa,opencl,gpu -device=kmppa -max_num_threads=64", "conv2d_ttile_", [1, 56, 56, 128, 128, 3, 3, 1, 1, 1, 1, 1, 1], {}], "config": {"index": 659, "code_hash": null, "entity": [["tile_in_channels", "ot", 8], ["tile_out_channels", "ot", 4], ["tile_xx", "ot", 4], ["tile_yy", "ot", 2]]}, "result": [[0.130748621375, 0.13073471590000002], 0, 12.836999416351318, 1615561650.8793652], "version": 0.2, "tvm_version": "0.8.dev0"}
{"input": ["opencl -keys=kmppa,opencl,gpu -device=kmppa -max_num_threads=64", "conv2d_ttile_", [1, 56, 56, 128, 128, 3, 3, 1, 1, 1, 1, 1, 1], {}], "config": {"index": 664, "code_hash": null, "entity": [["tile_in_channels", "ot", 1], ["tile_out_channels", "ot", 8], ["tile_xx", "ot", 4], ["tile_yy", "ot", 2]]}, "result": [[0.10675081680000001, 0.10681477025], 0, 10.763321876525879, 1615561682.6058514], "version": 0.2, "tvm_version": "0.8.dev0"}
{"input": ["opencl -keys=kmppa,opencl,gpu -device=kmppa -max_num_threads=64", "conv2d_ttile_", [1, 56, 56, 128, 128, 3, 3, 1, 1, 1, 1, 1, 1], {}], "config": {"index": 2569, "code_hash": null, "entity": [["tile_in_channels", "ot", 2], ["tile_out_channels", "ot", 2], ["tile_xx", "ot", 1], ["tile_yy", "ot", 14]]}, "result": [[0.1306446201, 0.13064435285], 0, 12.804221153259277, 1615561697.7216594], "version": 0.2, "tvm_version": "0.8.dev0"}
{"input": ["opencl -keys=kmppa,opencl,gpu -device=kmppa -max_num_threads=64", "conv2d_ttile_", [1, 56, 56, 128, 128, 3, 3, 1, 1, 1, 1, 1, 1], {}], "config": {"index": 726, "code_hash": null, "entity": [["tile_in_channels", "ot", 64], ["tile_out_channels", "ot", 4], ["tile_xx", "ot", 7], ["tile_yy", "ot", 2]]}, "result": [[0.10311366417500001, 0.10309324955000002], 0, 10.4313485622406, 1615561713.0658836], "version": 0.2, "tvm_version": "0.8.dev0"}
{"input": ["opencl -keys=kmppa,opencl,gpu -device=kmppa -max_num_threads=64", "conv2d_ttile_", [1, 56, 56, 128, 128, 3, 3, 1, 1, 1, 1, 1, 1], {}], "config": {"index": 1162, "code_hash": null, "entity": [["tile_in_channels", "ot", 4], ["tile_out_channels", "ot", 2], ["tile_xx", "ot", 4], ["tile_yy", "ot", 4]]}, "result": [[0.11428881269999999, 0.11427025234999999], 0, 10.121787786483765, 1615561725.6736033], "version": 0.2, "tvm_version": "0.8.dev0"}
